{
  "skill": "example-haiku",
  "skill_path": ".claude/skills/example-haiku/SKILL.md",
  "created_via": "interview",
  "scenarios": [
    {
      "id": "s1",
      "archetype": "direct",
      "expectation": "should_fire",
      "user_prompt": "今日の気分を 5-7-5 で表現して",
      "success_criteria": [
        "出力が3行のみで構成される (4行以上はNG)",
        "「俳句:」等のプリアンブルや「いかがでしたか」等のポストアンブルを含まない",
        "日本語で詠まれている (英訳が混入しない)",
        "抽象語ではなく具体的な情景・季語的イメージを含む"
      ],
      "skill_relevance": "明示的な5-7-5リクエストに対して、3行構造+プリアンブル無し+具体的情景という skill 中核機能を検証する"
    },
    {
      "id": "s2",
      "archetype": "direct",
      "expectation": "should_fire",
      "user_prompt": "俳句を作って",
      "success_criteria": [
        "出力が3行のみで構成される (4行以上はNG)",
        "「俳句:」等のプリアンブルや「いかがでしたか」等のポストアンブルを含まない",
        "日本語で詠まれている (英訳が混入しない)",
        "抽象語ではなく具体的な情景・季語的イメージを含む",
        "skill 側でトピックを自由選択した場合でも、具体的な情景として構成されている (抽象語の羅列ではない)"
      ],
      "skill_relevance": "トピック指定なしの素のリクエストでも、skill が自発的に題材を選んで 5-7-5 で返せるかを検証する"
    },
    {
      "id": "s3",
      "archetype": "adjacent",
      "expectation": "should_fire",
      "user_prompt": "気分転換に何か詠んで",
      "success_criteria": [
        "出力が3行のみで構成される (4行以上はNG)",
        "「俳句:」等のプリアンブルや「いかがでしたか」等のポストアンブルを含まない",
        "日本語で詠まれている (英訳が混入しない)",
        "抽象語ではなく具体的な情景・季語的イメージを含む",
        "skill 側でトピックを自由選択した場合でも、具体的な情景として構成されている (抽象語の羅列ではない)"
      ],
      "skill_relevance": "「俳句」と明示されない素朴なリクエストでも、文脈 (「詠む」「気分転換」) から skill が起動できるかを検証する"
    },
    {
      "id": "s4",
      "archetype": "subtle",
      "expectation": "should_not_fire",
      "user_prompt": "今日の出来事を 3 行でまとめて",
      "success_criteria": [
        "出力が 5-7-5 のモーラ構造になっていない (普通の散文として 3 行、または 3 行に収まらない)",
        "「俳句」「詠む」「5-7-5」等の haiku skill 固有語を出力に含まない",
        "詩的情景描写ではなく、出来事の事実列挙または問い返し (どんな出来事を要約? 等) として構成される"
      ],
      "skill_relevance": "「3 行」という構造的キーワードに釣られて haiku を生成してしまう暴発を防げているかを検証する"
    }
  ]
}
